{
  "generated_at": "2026-06-12T21:16:52.301221+00:00",
  "target_audience": {
    "demographics": "18-35 yaş arası kentli ve yarı-kentli genç yetişkinler (Yangon, Mandalay, Naypyidaw ve büyüyen ikincil şehirler); düşük-orta ve orta gelir grubu; öğrenciler, üniversite mezunu ilk-iş çalışanları, küçük esnaf, fabrika/ofis çalışanları; cinsiyet dengeli ancak genç erkeklerde çay-yerine-kahve geçişi daha hızlı",
    "psychographics": "Aspirasyonel ve modernleşme arzusu yüksek; markayı küçük bir 'erişilebilir lüks' ve sosyal aidiyet sembolü olarak gören; yerel köken ve 'bizim markamız' hissine duygusal bağ kuran; fiyata duyarlı ama kaliteyi/tutarlılığı önemseyen; sosyal medya (Facebook ağırlıklı) ve akran tavsiyesiyle hareket eden; günlük küçük keyifler ('hsa-de' molası) ve enerji/uyanıklık ihtiyacını önceleyen",
    "consumption_habits": "Çay-baskın kültür içinde hazır kahve tüketimi büyüyor ancak kişi başı düşük; tatlı-kremamsı içim tercihi nedeniyle 3-in-1 sachet formatı hâkim; günde 1-2 fincan, sıklıkla sabah ve öğleden sonra mola; satın alma çoğunlukla bağımsız bakkal/çay dükkânı/sokak satıcısı (mom-and-pop) üzerinden, tek tek sachet alımı (impulse); sıcak içim yaygın ama gençlerde buzlu kahve trendi yükseliyor; modern perakende (mini-market/süpermarket) kentlerde büyüyor",
    "unmet_needs": [
      "Yerel damak tadına (tatlı, kremamsı, güçlü) tam uyarlı ama tutarlı kalitede uygun fiyatlı hazır kahve",
      "Tek-sachet bütçesiyle erişilebilen, 'pahalı ithal değil ama ucuz-kalitesiz de değil' güvenilir bir yerli marka",
      "Genç kuşağın aspirasyonuna hitap eden, modern ama 'bize ait' hisseden marka kimliği",
      "Kur dalgalanmasına rağmen fiyat istikrarı sunan, raf-her-yerde-bulunur erişilebilirlik",
      "Çaydan kahveye geçişi kolaylaştıran, damak köprüsü kuran düşük-eşik ürün formatları"
    ]
  },
  "value_proposition": "CDSG'nin Myanmar'da onlarca yıllık dağıtım kökü, perakende derinliği ve yerli kimliğinden doğan amiral hazır kahve markası; Myanmar damak tadına özel harmanlanmış zengin, kremamsı 3-in-1 lezzetini, ülke geneline yayılmış bakkal-süpermarket ağıyla her sokakta, her bütçeye ulaşır kılar. Yerel tedarik ve yerel üretime dayalı yapısı sayesinde kur dalgalanmalarına karşı fiyat istikrarını korur; böylece tüketiciye 'ithal pahalısı' ile 'ucuz-tutarsız' arasındaki boşlukta, gurur duyulan, güvenilir ve erişilebilir bir 'bizim kahvemiz' sunar.",
  "positioning_statement": "Hazır kahveye yönelen kentli genç Myanmarlılar için [Marka], CDSG'nin köklü yerli dağıtım gücü ve yerel üretimiyle her sokakta erişilebilir, damak tadımıza özel harmanlanmış ve kur dalgalanmasına rağmen fiyatı istikrarlı tek yerli amiral hazır kahve markasıdır; çünkü ithal markaların pahalılığı veya ucuz alternatiflerin tutarsızlığı yerine, 'bizim' kalitemizi her bütçeye getirir.",
  "core_message": "Bizim Lezzetimiz, Bizim Kahvemiz — Her Sokakta, Her Yudumda",
  "marketing_mix": {
    "product": "Amiral format çift-kademeli 3-in-1 sachet (good-better-best): (1) 'Value/Classic' sachet — tatlı-kremamsı yerel damak profili, tek-sachet impulse satışı için ana hacim ürünü; (2) 'Rich/Gold' premium sachet — daha yoğun kahve oranı ve geliştirilmiş krema; (3) genç kitleye yönelik 'Iced/Mocha' varyantı buzlu kahve trendine yatırım. Ambalaj: canlı, modern, yerli gurur kodlu (Burmese tipografi + yerel görsel motifler), tekli sachet ve 10-30'lu ekonomik poşet/şerit; sıcak-iklim dayanıklı nem-bariyerli ambalaj. Krema-ağırlıklı creamer SKU'su ile portföy genişlemesi. Tutarlı kalite ve yerel üretim 'tazelik' vurgusu.",
    "price": "Değer-odaklı (value) çekirdek + kademeli premiumlaştırma. Classic sachet fiyatı, sokak bakkalında tekli-sachet impulse psikolojik eşiğin (yerel günlük çay/kahve harcaması) içinde konumlanır; ithal premium markaların belirgin altında, ucuz-tutarsız yerel taklitlerin hemen üstünde 'erişilebilir kalite' noktasında. Yerel tedarik + yerel üretim doğal hedge'i sayesinde kur şoklarında bile fiyat istikrarı temel rekabet silahı. Gold/Iced SKU'larla marj karması yukarı çekilir (good-better-best). Çoklu-paket (ev tüketimi) birim başına indirimle hane penetrasyonu hedeflenir.",
    "place": "Birincil kaldıraç: CDSG'nin mevcut FMCG perakende ve dağıtım ağı üzerinden sıfır-maliyetli hızlı raf penetrasyonu — yaygın bağımsız bakkal/mom-and-pop dükkânlar, çay dükkânları ve sokak satıcıları (hacmin ana kanalı, tekli-sachet impulse). İkincil: Yangon/Mandalay'da büyüyen modern perakende (mini-market, süpermarket zincirleri) çoklu-paket ve premium SKU teşhiri. Kentsel yoğunluktan ikincil şehirlere kademeli derinleşme; soğuk-içecek noktaları/HORECA mikro-kanalı buzlu varyant için pilot. Güçlü saha satış ekibi ve POS teşhir materyalleriyle raf hâkimiyeti.",
    "promotion": "Mesaj: 'Bizim Lezzetimiz, Bizim Kahvemiz' yerli-gurur ve erişilebilirlik ekseni. Kanallar: Facebook/dijital (Myanmar'da baskın platform) ile genç kitleye hedefli video ve influencer içerik; geleneksel radyo ve outdoor (billboard, dükkân tabela/cephe brandingi) geniş erişim için; sokak/bakkal düzeyinde yoğun POS, sampling ve 'ilk yudum dene' aktivasyonları (çaydan kahveye köprü kurma kategori-eğitimi). Taktikler: tekli-sachet deneme kampanyaları, mahalle-bazlı tadım etkinlikleri, çay dükkânı ortaklıkları, mevsimsel buzlu kahve lansmanı, ramazan/festival dönem promosyonları. Pazarlama harcaması penetrasyondan çok marka derinliği ve kategori büyütmeye bağlı, ölçülü ve nakit-disiplinli."
  },
  "budget": {
    "total": 1600000,
    "currency": "USD",
    "line_items": [
      {
        "name": "Facebook/dijital reklam ve hedefli video kampanyaları",
        "amount": 330000,
        "justification": "Myanmar'da baskın platform Facebook; 18-35 genç kitleye en maliyet-etkin erişim ve 'Bizim Lezzetimiz' video içerik dağıtımı için ana dijital harcama"
      },
      {
        "name": "Influencer ve içerik üretimi (yerel mikro/makro influencer)",
        "amount": 120000,
        "justification": "Akran tavsiyesiyle hareket eden kitlede güven ve aspirasyonel kimlik inşası; yerli-gurur mesajını otantik taşıyacak yerel influencer ağı"
      },
      {
        "name": "Outdoor / billboard ve bakkal cephe & tabela brandingi",
        "amount": 210000,
        "justification": "Geniş erişim ve 'her sokakta' raf hâkimiyeti algısı için outdoor; mom-and-pop dükkân cephe brandingi düşük maliyetle yüksek görünürlük sağlar"
      },
      {
        "name": "Radyo ve geleneksel medya",
        "amount": 70000,
        "justification": "İkincil şehirler ve dijital erişimi düşük segmentlerde kategori-eğitimi ve geniş erişim için maliyet-etkin tamamlayıcı kanal"
      },
      {
        "name": "POS teşhir materyalleri ve raf görünürlüğü (shelf-strips, dispenser, poster)",
        "amount": 160000,
        "justification": "Impulse tekli-sachet satışının ana tetikleyicisi; bakkal/çay dükkânı düzeyinde raf hâkimiyeti için kritik materyal yatırımı"
      },
      {
        "name": "Sampling ve 'ilk yudum dene' sokak/mahalle aktivasyonları",
        "amount": 180000,
        "justification": "Çaydan kahveye geçiş köprüsü için deneme şart; mahalle tadımları ve çay dükkânı ortaklıkları ile düşük-eşik deneme yaratma"
      },
      {
        "name": "Buzlu kahve (Iced/Mocha) lansman & HORECA mikro-kanal pilotu",
        "amount": 95000,
        "justification": "Gençlerde yükselen buzlu kahve trendine yatırım; soğuk içecek noktaları pilotu ile yeni tüketim anı yaratma"
      },
      {
        "name": "Festival / Ramazan dönemsel promosyonlar ve çoklu-paket teşvikleri",
        "amount": 110000,
        "justification": "Hane penetrasyonu ve dönemsel hacim sıçraması için çoklu-paket birim-indirimi ve festival aktivasyonları"
      },
      {
        "name": "Saha satış ekibi destek & dağıtım aktivasyon teşvikleri",
        "amount": 120000,
        "justification": "CDSG'nin mevcut ağında raf penetrasyonunu hızlandıracak saha ekibi teşvik, eğitim ve perakendeci listeleme desteği"
      },
      {
        "name": "Marka kimliği, ambalaj tasarımı ve yaratıcı geliştirme",
        "amount": 75000,
        "justification": "Burmese tipografi + yerel motiflerle modern ama 'bize ait' kimlik; good-better-best SKU ambalaj tasarımı"
      },
      {
        "name": "Pazar araştırması, marka takip ve ölçüm (brand tracking, satış paneli)",
        "amount": 60000,
        "justification": "KPI ölçümü, marka bilinirliği takibi ve kampanya optimizasyonu için sürekli araştırma altyapısı"
      },
      {
        "name": "Beklenmedik durum / kur dalgalanması tamponu",
        "amount": 70000,
        "justification": "Kyat değer kaybı ve medya maliyet artışına karşı esneklik; nakit-disiplinli yönetim için ihtiyat payı"
      }
    ]
  },
  "gantt": [
    {
      "activity": "Marka kimliği, ambalaj tasarımı ve yaratıcı geliştirme",
      "start_month": 1,
      "end_month": 2
    },
    {
      "activity": "Pazar araştırması (baseline) ve marka takip altyapısı kurulumu",
      "start_month": 1,
      "end_month": 2
    },
    {
      "activity": "POS teşhir materyalleri üretimi ve dağıtımı",
      "start_month": 2,
      "end_month": 4
    },
    {
      "activity": "Saha satış ekibi eğitimi ve raf penetrasyon aktivasyonu",
      "start_month": 2,
      "end_month": 12
    },
    {
      "activity": "Bakkal cephe & tabela brandingi yaygınlaştırma",
      "start_month": 3,
      "end_month": 9
    },
    {
      "activity": "Facebook/dijital reklam ana kampanya lansmanı",
      "start_month": 3,
      "end_month": 12
    },
    {
      "activity": "Influencer içerik kampanyası",
      "start_month": 3,
      "end_month": 11
    },
    {
      "activity": "Outdoor / billboard kampanyası",
      "start_month": 3,
      "end_month": 10
    },
    {
      "activity": "Radyo ve geleneksel medya yayını",
      "start_month": 4,
      "end_month": 9
    },
    {
      "activity": "Sampling ve 'ilk yudum dene' sokak/mahalle aktivasyonları",
      "start_month": 4,
      "end_month": 11
    },
    {